{
  "schema_version": "0.1",
  "id": "neurodivergent-friendships",
  "name": "Neurodivergent Friendships (Online + Anywhere)",
  "curator": [
    {
      "identity": "sam@example.com",
      "display_name": "Sam Tran",
      "verification_level": "email",
      "primary": true
    }
  ],
  "intent_tags": ["friendship", "neurodivergent", "autistic", "adhd", "online-friendly"],
  "visibility": "public",
  "consent_model": "universal-opt-in",
  "curator_contact": "sam@example.com",
  "charter": "A Pool for neurodivergent adults seeking friendships built on directness, predictability, and shared sensory and communication preferences. Members can be local or online-only. Profiles describe communication style explicitly (response cadence, preferred channels, tone preferences). Cancel-without-explanation friendly. The goal is fewer, deeper friendships built on understood expectations.",
  "messaging_preferences": {
    "minimum_sender_verification": "email"
  },
  "handshake_window_days": 21,
  "status": "active",
  "created_at": "2026-04-05T13:30:00Z",
  "updated_at": "2026-04-22T16:45:00Z",
  "entries": [
    {
      "profile_url": "https://kai.example",
      "verification_level": "email",
      "consent_proof": {
        "handshake_id": "aaaaaaaa-bbbb-cccc-dddd-eeeeeeeeeeee",
        "accepted_at": "2026-04-10T19:45:00Z",
        "method": "email-link"
      },
      "added_at": "2026-04-10T19:45:00Z",
      "added_by": "sam@example.com"
    },
    {
      "profile_url": "https://ohana.example/about",
      "verification_level": "email",
      "consent_proof": {
        "handshake_id": "ffffffff-1111-2222-3333-444444444444",
        "accepted_at": "2026-04-12T14:20:00Z",
        "method": "email-link"
      },
      "added_at": "2026-04-12T14:20:00Z",
      "added_by": "sam@example.com"
    }
  ]
}
